{"manifestVersion":"1.0.0","bundleName":"CAS Workstation","bundleId":"cas-workstation","defaults":{"rootPath":"C:\\CAS","configPath":"C:\\Users\\developer\\.cas","profile":"core"},"profiles":{"core":{"description":"Core","tools":[],"repos":[],"services":[]}},"paths":{"state":"state"},"tools":[],"repos":[],"clients":[],"sharedMcpServer":{"name":"refiner","transport":"stdio","command":"node","args":[]}}
